{"verdict":"pass","summary":"Diff vs baseline was limited to `runtime/swarm.rs`, `scripts/test-native-claspc.sh`, and `scripts/test-native-runtime.sh`. The new empty-objective manager response is covered at unit and CLI scenario level, the runtime script change was verified under Nix, and full `scripts/verify-all.sh` completed successfully.","findings":[],"tests_run":["`diff -ruN .clasp-loops/swarm-readiness-native-live/baseline-workspace .` (reviewed, then narrowed with `diff -rq`/targeted `diff -u`)","`bash scripts/test-native-claspc.sh`","`nix develop -c bash scripts/test-native-runtime.sh`","`env -u IN_NIX_SHELL bash scripts/verify-all.sh`"],"follow_up":[]}