{"verdict":"fail","summary":"Fail. The repository cannot be passed because the required repo-wide gate `bash scripts/verify-all.sh` does not succeed in the current checkout.","findings":["Mandatory acceptance criterion unmet: `bash scripts/verify-all.sh` exited with code 127. It failed in `scripts/test-native-runtime.sh` with `rustc: command not found`. The task explicitly requires `verify-all.sh` to pass before a pass verdict is allowed.","Targeted verification for the new ordinary-program path and orchestration substrate did pass via `bash scripts/test-native-claspc.sh`, including `claspc run examples/feedback-loop/Main.clasp`, persisted pass/fail loop state, Dict/list/polymorphism/record ergonomics, event-log swarm kernel behavior, and SQLite-backed swarm control-plane commands. But that is insufficient because the repo-wide acceptance gate still fails."],"tests_run":["Read `AGENTS.md`","Read `agents/tasks/0011-swarm-ready-full-goal.md`","Reviewed baseline diff with `diff -ruN .clasp-loops/swarm-ready-full-goal-live/baseline-workspace .`","Ran targeted verification: `bash scripts/test-native-claspc.sh`","Ran mandatory gate: `bash scripts/verify-all.sh`"],"follow_up":["Make `bash scripts/verify-all.sh` pass in this environment, starting with the failing `scripts/test-native-runtime.sh` dependency on `rustc`.","After the repo-wide gate passes, rerun verification and only then reconsider a pass verdict."]}